[
  {
    "assetId": "flower_daisy_seed",
    "category": "flowers_plants",
    "phase": "P0",
    "status": "planned",
    "relativeFile": null,
    "styleVersion": "bh_1_0",
    "promptPath": "asset_prompts/06_FLOWERS_PLANTS/FLOWER_MASTER_PROMPT.md",
    "referenceIds": [],
    "sourceTool": null,
    "generatedAt": null,
    "rightsNote": "Chưa sinh; kiểm điều khoản công cụ và quyền reference khi tạo.",
    "sha256": null,
    "targetWidth": 512,
    "targetHeight": 512,
    "alpha": true
  },
  {
    "assetId": "flower_daisy_sprout",
    "category": "flowers_plants",
    "phase": "P0",
    "status": "planned",
    "relativeFile": null,
    "styleVersion": "bh_1_0",
    "promptPath": "asset_prompts/06_FLOWERS_PLANTS/FLOWER_MASTER_PROMPT.md",
    "referenceIds": [],
    "sourceTool": null,
    "generatedAt": null,
    "rightsNote": "Chưa sinh; kiểm điều khoản công cụ và quyền reference khi tạo.",
    "sha256": null,
    "targetWidth": 512,
    "targetHeight": 512,
    "alpha": true
  },
  {
    "assetId": "flower_daisy_bud",
    "category": "flowers_plants",
    "phase": "P0",
    "status": "planned",
    "relativeFile": null,
    "styleVersion": "bh_1_0",
    "promptPath": "asset_prompts/06_FLOWERS_PLANTS/FLOWER_MASTER_PROMPT.md",
    "referenceIds": [],
    "sourceTool": null,
    "generatedAt": null,
    "rightsNote": "Chưa sinh; kiểm điều khoản công cụ và quyền reference khi tạo.",
    "sha256": null,
    "targetWidth": 512,
    "targetHeight": 512,
    "alpha": true
  },
  {
    "assetId": "flower_daisy_bloom",
    "category": "flowers_plants",
    "phase": "P0",
    "status": "planned",
    "relativeFile": null,
    "styleVersion": "bh_1_0",
    "promptPath": "asset_prompts/06_FLOWERS_PLANTS/FLOWER_MASTER_PROMPT.md",
    "referenceIds": [],
    "sourceTool": null,
    "generatedAt": null,
    "rightsNote": "Chưa sinh; kiểm điều khoản công cụ và quyền reference khi tạo.",
    "sha256": null,
    "targetWidth": 512,
    "targetHeight": 512,
    "alpha": true
  },
  {
    "assetId": "flower_daisy_ready",
    "category": "flowers_plants",
    "phase": "P0",
    "status": "planned",
    "relativeFile": null,
    "styleVersion": "bh_1_0",
    "promptPath": "asset_prompts/06_FLOWERS_PLANTS/FLOWER_MASTER_PROMPT.md",
    "referenceIds": [],
    "sourceTool": null,
    "generatedAt": null,
    "rightsNote": "Chưa sinh; kiểm điều khoản công cụ và quyền reference khi tạo.",
    "sha256": null,
    "targetWidth": 512,
    "targetHeight": 512,
    "alpha": true
  },
  {
    "assetId": "flower_tulip_seed",
    "category": "flowers_plants",
    "phase": "P0",
    "status": "planned",
    "relativeFile": null,
    "styleVersion": "bh_1_0",
    "promptPath": "asset_prompts/06_FLOWERS_PLANTS/FLOWER_MASTER_PROMPT.md",
    "referenceIds": [],
    "sourceTool": null,
    "generatedAt": null,
    "rightsNote": "Chưa sinh; kiểm điều khoản công cụ và quyền reference khi tạo.",
    "sha256": null,
    "targetWidth": 512,
    "targetHeight": 512,
    "alpha": true
  },
  {
    "assetId": "flower_tulip_sprout",
    "category": "flowers_plants",
    "phase": "P0",
    "status": "planned",
    "relativeFile": null,
    "styleVersion": "bh_1_0",
    "promptPath": "asset_prompts/06_FLOWERS_PLANTS/FLOWER_MASTER_PROMPT.md",
    "referenceIds": [],
    "sourceTool": null,
    "generatedAt": null,
    "rightsNote": "Chưa sinh; kiểm điều khoản công cụ và quyền reference khi tạo.",
    "sha256": null,
    "targetWidth": 512,
    "targetHeight": 512,
    "alpha": true
  },
  {
    "assetId": "flower_tulip_bud",
    "category": "flowers_plants",
    "phase": "P0",
    "status": "planned",
    "relativeFile": null,
    "styleVersion": "bh_1_0",
    "promptPath": "asset_prompts/06_FLOWERS_PLANTS/FLOWER_MASTER_PROMPT.md",
    "referenceIds": [],
    "sourceTool": null,
    "generatedAt": null,
    "rightsNote": "Chưa sinh; kiểm điều khoản công cụ và quyền reference khi tạo.",
    "sha256": null,
    "targetWidth": 512,
    "targetHeight": 512,
    "alpha": true
  },
  {
    "assetId": "flower_tulip_bloom",
    "category": "flowers_plants",
    "phase": "P0",
    "status": "planned",
    "relativeFile": null,
    "styleVersion": "bh_1_0",
    "promptPath": "asset_prompts/06_FLOWERS_PLANTS/FLOWER_MASTER_PROMPT.md",
    "referenceIds": [],
    "sourceTool": null,
    "generatedAt": null,
    "rightsNote": "Chưa sinh; kiểm điều khoản công cụ và quyền reference khi tạo.",
    "sha256": null,
    "targetWidth": 512,
    "targetHeight": 512,
    "alpha": true
  },
  {
    "assetId": "flower_tulip_ready",
    "category": "flowers_plants",
    "phase": "P0",
    "status": "planned",
    "relativeFile": null,
    "styleVersion": "bh_1_0",
    "promptPath": "asset_prompts/06_FLOWERS_PLANTS/FLOWER_MASTER_PROMPT.md",
    "referenceIds": [],
    "sourceTool": null,
    "generatedAt": null,
    "rightsNote": "Chưa sinh; kiểm điều khoản công cụ và quyền reference khi tạo.",
    "sha256": null,
    "targetWidth": 512,
    "targetHeight": 512,
    "alpha": true
  },
  {
    "assetId": "flower_marigold_seed",
    "category": "flowers_plants",
    "phase": "P0",
    "status": "planned",
    "relativeFile": null,
    "styleVersion": "bh_1_0",
    "promptPath": "asset_prompts/06_FLOWERS_PLANTS/FLOWER_MASTER_PROMPT.md",
    "referenceIds": [],
    "sourceTool": null,
    "generatedAt": null,
    "rightsNote": "Chưa sinh; kiểm điều khoản công cụ và quyền reference khi tạo.",
    "sha256": null,
    "targetWidth": 512,
    "targetHeight": 512,
    "alpha": true
  },
  {
    "assetId": "flower_marigold_sprout",
    "category": "flowers_plants",
    "phase": "P0",
    "status": "planned",
    "relativeFile": null,
    "styleVersion": "bh_1_0",
    "promptPath": "asset_prompts/06_FLOWERS_PLANTS/FLOWER_MASTER_PROMPT.md",
    "referenceIds": [],
    "sourceTool": null,
    "generatedAt": null,
    "rightsNote": "Chưa sinh; kiểm điều khoản công cụ và quyền reference khi tạo.",
    "sha256": null,
    "targetWidth": 512,
    "targetHeight": 512,
    "alpha": true
  },
  {
    "assetId": "flower_marigold_bud",
    "category": "flowers_plants",
    "phase": "P0",
    "status": "planned",
    "relativeFile": null,
    "styleVersion": "bh_1_0",
    "promptPath": "asset_prompts/06_FLOWERS_PLANTS/FLOWER_MASTER_PROMPT.md",
    "referenceIds": [],
    "sourceTool": null,
    "generatedAt": null,
    "rightsNote": "Chưa sinh; kiểm điều khoản công cụ và quyền reference khi tạo.",
    "sha256": null,
    "targetWidth": 512,
    "targetHeight": 512,
    "alpha": true
  },
  {
    "assetId": "flower_marigold_bloom",
    "category": "flowers_plants",
    "phase": "P0",
    "status": "planned",
    "relativeFile": null,
    "styleVersion": "bh_1_0",
    "promptPath": "asset_prompts/06_FLOWERS_PLANTS/FLOWER_MASTER_PROMPT.md",
    "referenceIds": [],
    "sourceTool": null,
    "generatedAt": null,
    "rightsNote": "Chưa sinh; kiểm điều khoản công cụ và quyền reference khi tạo.",
    "sha256": null,
    "targetWidth": 512,
    "targetHeight": 512,
    "alpha": true
  },
  {
    "assetId": "flower_marigold_ready",
    "category": "flowers_plants",
    "phase": "P0",
    "status": "planned",
    "relativeFile": null,
    "styleVersion": "bh_1_0",
    "promptPath": "asset_prompts/06_FLOWERS_PLANTS/FLOWER_MASTER_PROMPT.md",
    "referenceIds": [],
    "sourceTool": null,
    "generatedAt": null,
    "rightsNote": "Chưa sinh; kiểm điều khoản công cụ và quyền reference khi tạo.",
    "sha256": null,
    "targetWidth": 512,
    "targetHeight": 512,
    "alpha": true
  },
  {
    "assetId": "flower_lavender_seed",
    "category": "flowers_plants",
    "phase": "P1",
    "status": "planned",
    "relativeFile": null,
    "styleVersion": "bh_1_0",
    "promptPath": "asset_prompts/06_FLOWERS_PLANTS/FLOWER_MASTER_PROMPT.md",
    "referenceIds": [],
    "sourceTool": null,
    "generatedAt": null,
    "rightsNote": "Chưa sinh; kiểm điều khoản công cụ và quyền reference khi tạo.",
    "sha256": null,
    "targetWidth": 512,
    "targetHeight": 512,
    "alpha": true
  },
  {
    "assetId": "flower_lavender_sprout",
    "category": "flowers_plants",
    "phase": "P1",
    "status": "planned",
    "relativeFile": null,
    "styleVersion": "bh_1_0",
    "promptPath": "asset_prompts/06_FLOWERS_PLANTS/FLOWER_MASTER_PROMPT.md",
    "referenceIds": [],
    "sourceTool": null,
    "generatedAt": null,
    "rightsNote": "Chưa sinh; kiểm điều khoản công cụ và quyền reference khi tạo.",
    "sha256": null,
    "targetWidth": 512,
    "targetHeight": 512,
    "alpha": true
  },
  {
    "assetId": "flower_lavender_bud",
    "category": "flowers_plants",
    "phase": "P1",
    "status": "planned",
    "relativeFile": null,
    "styleVersion": "bh_1_0",
    "promptPath": "asset_prompts/06_FLOWERS_PLANTS/FLOWER_MASTER_PROMPT.md",
    "referenceIds": [],
    "sourceTool": null,
    "generatedAt": null,
    "rightsNote": "Chưa sinh; kiểm điều khoản công cụ và quyền reference khi tạo.",
    "sha256": null,
    "targetWidth": 512,
    "targetHeight": 512,
    "alpha": true
  },
  {
    "assetId": "flower_lavender_bloom",
    "category": "flowers_plants",
    "phase": "P1",
    "status": "planned",
    "relativeFile": null,
    "styleVersion": "bh_1_0",
    "promptPath": "asset_prompts/06_FLOWERS_PLANTS/FLOWER_MASTER_PROMPT.md",
    "referenceIds": [],
    "sourceTool": null,
    "generatedAt": null,
    "rightsNote": "Chưa sinh; kiểm điều khoản công cụ và quyền reference khi tạo.",
    "sha256": null,
    "targetWidth": 512,
    "targetHeight": 512,
    "alpha": true
  },
  {
    "assetId": "flower_lavender_ready",
    "category": "flowers_plants",
    "phase": "P1",
    "status": "planned",
    "relativeFile": null,
    "styleVersion": "bh_1_0",
    "promptPath": "asset_prompts/06_FLOWERS_PLANTS/FLOWER_MASTER_PROMPT.md",
    "referenceIds": [],
    "sourceTool": null,
    "generatedAt": null,
    "rightsNote": "Chưa sinh; kiểm điều khoản công cụ và quyền reference khi tạo.",
    "sha256": null,
    "targetWidth": 512,